{
  "$schema": "https://json-schema.org/draft/2020-12/schema",
  "title": "Cyber exercise configuration",
  "_note": "Formal rules for the configuration file of an exercise. It holds no content — a fillable skeleton lies in ../Vorlagen/, the populated example exercise in ../Daten/.",
  "type": "object",
  "required": [
    "exercise",
    "time_model",
    "actors"
  ],
  "additionalProperties": false,
  "properties": {
    "_note": {
      "type": "string"
    },
    "exercise": {
      "type": "object",
      "required": [
        "id",
        "name"
      ],
      "additionalProperties": false,
      "properties": {
        "_note": {
          "type": "string"
        },
        "id": {
          "type": "string",
          "minLength": 1
        },
        "name": {
          "type": "string",
          "minLength": 1
        },
        "conducted_at": {
          "type": "string"
        }
      }
    },
    "time_model": {
      "type": "object",
      "required": [
        "tick_minutes",
        "business_day",
        "phases"
      ],
      "additionalProperties": false,
      "properties": {
        "_note": {
          "type": "string"
        },
        "tick_minutes": {
          "type": "integer",
          "minimum": 1
        },
        "compression_factor": {
          "type": "number",
          "minimum": 1
        },
        "min_event_gap_minutes": {
          "type": "integer",
          "minimum": 0
        },
        "playback_ms_per_tick": {
          "type": "integer",
          "minimum": 1
        },
        "business_day": {
          "type": "object",
          "required": [
            "start",
            "end"
          ],
          "additionalProperties": false,
          "properties": {
            "start": {
              "type": "string",
              "pattern": "^\\d{1,2}:\\d{2}$"
            },
            "end": {
              "type": "string",
              "pattern": "^\\d{1,2}:\\d{2}$"
            }
          }
        },
        "phases": {
          "type": "array",
          "minItems": 1,
          "items": {
            "type": "object",
            "required": [
              "label",
              "narrative_start",
              "narrative_end"
            ],
            "additionalProperties": false,
            "properties": {
              "_note": {
                "type": "string"
              },
              "label": {
                "type": "string",
                "minLength": 1
              },
              "narrative_start": {
                "type": "string",
                "pattern": "^\\d{4}-\\d{2}-\\d{2}[T ]\\d{2}:\\d{2}"
              },
              "narrative_end": {
                "type": "string",
                "pattern": "^\\d{4}-\\d{2}-\\d{2}[T ]\\d{2}:\\d{2}"
              },
              "real_start": {
                "type": "string"
              },
              "briefing": {
                "type": "string"
              }
            }
          }
        }
      }
    },
    "control_ids": {
      "type": "object",
      "additionalProperties": false,
      "properties": {
        "_note": {
          "type": "string"
        },
        "facilitator": {
          "type": "string"
        }
      }
    },
    "actors": {
      "type": "array",
      "minItems": 1,
      "items": {
        "type": "object",
        "required": [
          "id",
          "name"
        ],
        "additionalProperties": false,
        "properties": {
          "_note": {
            "type": "string"
          },
          "id": {
            "$ref": "#/$defs/identifier"
          },
          "name": {
            "type": "string",
            "minLength": 1
          },
          "address": {
            "type": "string"
          },
          "order": {
            "type": "integer"
          },
          "color": {
            "type": "string",
            "pattern": "^#[0-9a-fA-F]{6}$"
          }
        }
      }
    },
    "components": {
      "type": "array",
      "items": {
        "type": "object",
        "required": [
          "id",
          "name",
          "initial_state"
        ],
        "additionalProperties": false,
        "properties": {
          "_note": {
            "type": "string"
          },
          "id": {
            "$ref": "#/$defs/identifier"
          },
          "name": {
            "type": "string",
            "minLength": 1
          },
          "address": {
            "type": "string"
          },
          "initial_state": {
            "type": "string",
            "minLength": 1
          },
          "depends_on": {
            "type": "array",
            "items": {
              "$ref": "#/$defs/identifier"
            }
          }
        }
      }
    },
    "vocabulary": {
      "type": "object",
      "required": [
        "component_states"
      ],
      "additionalProperties": false,
      "properties": {
        "_note": {
          "type": "string"
        },
        "component_states": {
          "type": "array",
          "minItems": 1,
          "items": {
            "type": "object",
            "required": [
              "name",
              "category"
            ],
            "additionalProperties": false,
            "properties": {
              "name": {
                "type": "string",
                "minLength": 1
              },
              "category": {
                "type": "string",
                "enum": [
                  "ok",
                  "warning",
                  "critical"
                ]
              }
            }
          }
        }
      }
    },
    "metrics": {
      "type": "array",
      "items": {
        "type": "object",
        "required": [
          "id",
          "label",
          "start"
        ],
        "additionalProperties": false,
        "properties": {
          "_note": {
            "type": "string"
          },
          "id": {
            "type": "string",
            "minLength": 1
          },
          "label": {
            "type": "string",
            "minLength": 1
          },
          "unit": {
            "_note": "Durations are computed without exception in working hours of the business day; unit is only the label for it. Hence 'h' or — for count metrics — empty, so the unit does not promise something other than what the computation delivers.",
            "type": "string",
            "enum": [
              "h",
              ""
            ]
          },
          "color": {
            "type": "string",
            "pattern": "^#[0-9a-fA-F]{6}$"
          },
          "start": {
            "$ref": "#/$defs/selector"
          },
          "end": {
            "$ref": "#/$defs/selector"
          }
        }
      }
    },
    "cost_categories": {
      "type": "array",
      "items": {
        "type": "object",
        "required": [
          "id",
          "label"
        ],
        "additionalProperties": false,
        "properties": {
          "_note": {
            "type": "string"
          },
          "id": {
            "type": "string",
            "minLength": 1
          },
          "label": {
            "type": "string",
            "minLength": 1
          },
          "color": {
            "type": "string",
            "pattern": "^#[0-9a-fA-F]{6}$"
          }
        }
      }
    },
    "costs": {
      "type": "array",
      "items": {
        "type": "object",
        "required": [
          "id",
          "category",
          "span"
        ],
        "additionalProperties": false,
        "properties": {
          "_note": {
            "type": "string"
          },
          "id": {
            "type": "string",
            "minLength": 1
          },
          "label": {
            "type": "string"
          },
          "category": {
            "type": "string",
            "minLength": 1
          },
          "rate_per_hour": {
            "type": "number",
            "minimum": 0
          },
          "rate_per_workday": {
            "type": "number",
            "minimum": 0
          },
          "flat_fee": {
            "type": "number",
            "minimum": 0
          },
          "span": {
            "type": "object",
            "required": [
              "metric"
            ],
            "additionalProperties": false,
            "properties": {
              "metric": {
                "type": "string",
                "minLength": 1
              }
            }
          }
        }
      }
    }
  },
  "$defs": {
    "identifier": {
      "_note": "Identifier of an actor or a component. At runtime it becomes part of an SVG id and of a url(#...) reference (arrowheads in aspect 1) — spaces and markup characters would break that reference. Umlauts and other national characters remain explicitly allowed.",
      "type": "string",
      "minLength": 1,
      "pattern": "^[^\\s#\"'<>&/\\\\()]+$"
    },
    "selector": {
      "type": "object",
      "required": [
        "source",
        "where",
        "pick"
      ],
      "additionalProperties": false,
      "properties": {
        "source": {
          "type": "string",
          "enum": [
            "communication",
            "tasks",
            "infrastructure"
          ]
        },
        "where": {
          "type": "object"
        },
        "pick": {
          "type": "string",
          "enum": [
            "first",
            "last",
            "count"
          ]
        }
      }
    }
  }
}
